{
  "$schema": "https://json-schema.org/draft/2020-12/schema",
  "$id": "urn:moirae:accord-02e4r3:dependency-graph:0.2",
  "contract_id": "urn:moirae:accord-02e4r3:dependency-graph",
  "contract_version": "0.2",
  "derived_from": {
    "reference_kind": "CONTRACT",
    "contract_id": "urn:moirae:accord-02e4r3:validation-rules",
    "contract_version": "0.2"
  },
  "node_inventory": [
    "ORC-001",
    "ORC-002",
    "ORC-003",
    "ARM-001",
    "ARM-002",
    "ARM-003",
    "ARM-004",
    "ARM-005",
    "ARM-006",
    "ARM-007",
    "RAW-001",
    "RAW-002",
    "RAW-003",
    "PROJ-001",
    "PROJ-002",
    "PROJ-003",
    "PROJ-004",
    "LIN-001",
    "LIN-002",
    "LIN-003",
    "LIN-004",
    "LIN-005",
    "LIN-006",
    "LIN-007",
    "LIN-008",
    "PROP-001",
    "PROP-002",
    "PROP-003",
    "PROP-004",
    "PROP-005",
    "SCORE-001",
    "SCORE-002",
    "SCORE-003",
    "BND-001",
    "BND-002",
    "BND-003",
    "BND-004",
    "BND-005",
    "RUN-001",
    "RUN-002",
    "RUN-003",
    "RUN-004",
    "EXT-001",
    "EXT-002",
    "EXT-003",
    "EXT-004",
    "EXT-005",
    "EXT-006",
    "SRC-001",
    "SRC-002",
    "SRC-003",
    "SRC-004",
    "VIS-001",
    "NORM-001",
    "NORM-002",
    "NORM-003",
    "NORM-004",
    "NORM-005",
    "CLF-001",
    "CLF-002",
    "CLF-003",
    "CLF-004",
    "PRED-001",
    "PRED-002",
    "PRED-003",
    "PRED-004",
    "DIGEST-001",
    "DIGEST-002",
    "DIGEST-003",
    "LIN-009",
    "PROP-006",
    "PKG-001",
    "PKG-002",
    "PROF-001",
    "PROF-002",
    "SCHEMA-001",
    "SCHEMA-002",
    "ROLE-001",
    "DIGEST-CANON-001",
    "DIGEST-CANON-002",
    "DIGEST-CANON-003",
    "SCENARIO-ID-001",
    "E4R1-PRED-001",
    "E4R1-PRED-002",
    "E4R1-PRED-003",
    "E4R1-AUTH-001",
    "E4R1-BIND-001",
    "E4R1-PROP-001",
    "E4R1-PART-001",
    "E4R1-PART-002",
    "E4R1-PART-003",
    "E4R1-NEG-001",
    "E4R1-NEG-002",
    "E4R1-ENT-001",
    "E4R1-CANON-001",
    "E4R1-EXPECT-001",
    "E4R1-CLOSE-001",
    "E4R2-REF-001",
    "E4R2-CANON-001",
    "E4R2-BIND-001",
    "E4R2-NEG-001",
    "E4R2-GRAPH-001",
    "E4R2-PROFILE-001",
    "E4R2-CLOSE-001"
  ],
  "edges": [
    {
      "from": "BND-002",
      "depends_on": [
        "BND-001"
      ]
    },
    {
      "from": "BND-003",
      "depends_on": [
        "BND-001"
      ]
    },
    {
      "from": "BND-004",
      "depends_on": [
        "PKG-001",
        "PKG-002",
        "SCHEMA-001",
        "SCHEMA-002"
      ]
    },
    {
      "from": "BND-005",
      "depends_on": [
        "PKG-001",
        "PKG-002",
        "PROF-001",
        "PROF-002"
      ]
    },
    {
      "from": "RUN-001",
      "depends_on": [
        "BND-005"
      ]
    },
    {
      "from": "RUN-002",
      "depends_on": [
        "BND-005"
      ]
    },
    {
      "from": "RUN-003",
      "depends_on": [
        "RUN-001",
        "ARM-001",
        "ARM-002"
      ]
    },
    {
      "from": "RUN-004",
      "depends_on": [
        "RUN-001",
        "RUN-002",
        "BND-003"
      ]
    },
    {
      "from": "EXT-001",
      "depends_on": [
        "BND-005"
      ]
    },
    {
      "from": "EXT-002",
      "depends_on": [
        "EXT-001"
      ]
    },
    {
      "from": "EXT-003",
      "depends_on": [
        "EXT-001",
        "BND-005"
      ]
    },
    {
      "from": "EXT-004",
      "depends_on": [
        "EXT-001",
        "BND-005"
      ]
    },
    {
      "from": "EXT-005",
      "depends_on": [
        "EXT-001"
      ]
    },
    {
      "from": "EXT-006",
      "depends_on": [
        "BND-005",
        "EXT-001"
      ]
    },
    {
      "from": "SRC-001",
      "depends_on": [
        "BND-005",
        "ARM-001"
      ]
    },
    {
      "from": "SRC-002",
      "depends_on": [
        "SRC-001"
      ]
    },
    {
      "from": "SRC-003",
      "depends_on": [
        "SRC-001"
      ]
    },
    {
      "from": "SRC-004",
      "depends_on": [
        "SRC-001",
        "EXT-001"
      ]
    },
    {
      "from": "VIS-001",
      "depends_on": [
        "BND-005",
        "RUN-001"
      ]
    },
    {
      "from": "NORM-001",
      "depends_on": [
        "RAW-001",
        "BND-005"
      ]
    },
    {
      "from": "NORM-002",
      "depends_on": [
        "NORM-001",
        "BND-003"
      ]
    },
    {
      "from": "NORM-003",
      "depends_on": [
        "NORM-001"
      ]
    },
    {
      "from": "NORM-004",
      "depends_on": [
        "NORM-001"
      ]
    },
    {
      "from": "NORM-005",
      "depends_on": [
        "NORM-002",
        "NORM-003"
      ]
    },
    {
      "from": "CLF-001",
      "depends_on": [
        "BND-005",
        "SRC-001"
      ]
    },
    {
      "from": "CLF-002",
      "depends_on": [
        "CLF-001",
        "SRC-001"
      ]
    },
    {
      "from": "CLF-003",
      "depends_on": [
        "CLF-001",
        "CLF-002"
      ]
    },
    {
      "from": "CLF-004",
      "depends_on": [
        "CLF-001"
      ]
    },
    {
      "from": "PRED-001",
      "depends_on": [
        "BND-005",
        "PROP-001"
      ]
    },
    {
      "from": "PRED-002",
      "depends_on": [
        "PRED-001"
      ]
    },
    {
      "from": "PRED-003",
      "depends_on": [
        "PRED-001"
      ]
    },
    {
      "from": "PRED-004",
      "depends_on": [
        "PRED-001",
        "PROP-001",
        "PROP-002"
      ]
    },
    {
      "from": "DIGEST-001",
      "depends_on": [
        "BND-004",
        "DIGEST-CANON-001",
        "DIGEST-CANON-002",
        "DIGEST-CANON-003"
      ]
    },
    {
      "from": "DIGEST-002",
      "depends_on": [
        "BND-005"
      ]
    },
    {
      "from": "DIGEST-003",
      "depends_on": [
        "DIGEST-001"
      ]
    },
    {
      "from": "LIN-009",
      "depends_on": [
        "LIN-001",
        "DIGEST-001"
      ]
    },
    {
      "from": "PROP-006",
      "depends_on": [
        "PROP-001",
        "LIN-002"
      ]
    },
    {
      "from": "PKG-002",
      "depends_on": [
        "PKG-001"
      ]
    },
    {
      "from": "PROF-001",
      "depends_on": [
        "PKG-001",
        "PKG-002"
      ]
    },
    {
      "from": "PROF-002",
      "depends_on": [
        "PROF-001"
      ]
    },
    {
      "from": "SCHEMA-001",
      "depends_on": [
        "PKG-001",
        "PKG-002"
      ]
    },
    {
      "from": "SCHEMA-002",
      "depends_on": [
        "SCHEMA-001"
      ]
    },
    {
      "from": "ROLE-001",
      "depends_on": [
        "PKG-001",
        "PKG-002",
        "PROF-001"
      ]
    },
    {
      "from": "DIGEST-CANON-001",
      "depends_on": [
        "PKG-001",
        "PKG-002",
        "PROF-001",
        "SCHEMA-001"
      ]
    },
    {
      "from": "DIGEST-CANON-002",
      "depends_on": [
        "DIGEST-CANON-001",
        "SCHEMA-001"
      ]
    },
    {
      "from": "DIGEST-CANON-003",
      "depends_on": [
        "DIGEST-CANON-001"
      ]
    },
    {
      "from": "SCENARIO-ID-001",
      "depends_on": [
        "PROF-001",
        "CLF-001"
      ]
    },
    {
      "from": "E4R1-PRED-001",
      "depends_on": [
        "PRED-004",
        "PKG-002"
      ]
    },
    {
      "from": "E4R1-PRED-002",
      "depends_on": [
        "E4R1-PRED-001"
      ]
    },
    {
      "from": "E4R1-PRED-003",
      "depends_on": [
        "E4R1-PRED-001"
      ]
    },
    {
      "from": "E4R1-AUTH-001",
      "depends_on": [
        "PKG-002",
        "E4R1-PRED-003"
      ]
    },
    {
      "from": "E4R1-BIND-001",
      "depends_on": [
        "PRED-001",
        "PRED-002",
        "E4R1-PRED-001"
      ]
    },
    {
      "from": "E4R1-PROP-001",
      "depends_on": [
        "SCHEMA-002",
        "E4R1-PRED-001"
      ]
    },
    {
      "from": "E4R1-PART-001",
      "depends_on": [
        "E4R1-BIND-001",
        "E4R1-PRED-001"
      ]
    },
    {
      "from": "E4R1-PART-002",
      "depends_on": [
        "E4R1-PART-001",
        "E4R1-PRED-001"
      ]
    },
    {
      "from": "E4R1-PART-003",
      "depends_on": [
        "E4R1-PRED-001",
        "PKG-002"
      ]
    },
    {
      "from": "E4R1-NEG-001",
      "depends_on": [
        "E4R1-PRED-001",
        "E4R1-BIND-001"
      ]
    },
    {
      "from": "E4R1-NEG-002",
      "depends_on": [
        "E4R1-NEG-001"
      ]
    },
    {
      "from": "E4R1-ENT-001",
      "depends_on": [
        "E4R1-PRED-001",
        "E4R1-AUTH-001"
      ]
    },
    {
      "from": "E4R1-CANON-001",
      "depends_on": [
        "DIGEST-CANON-001",
        "DIGEST-CANON-002"
      ]
    },
    {
      "from": "E4R1-EXPECT-001",
      "depends_on": [
        "PKG-002"
      ]
    },
    {
      "from": "E4R1-CLOSE-001",
      "depends_on": [
        "PKG-002",
        "E4R1-PRED-001",
        "E4R1-PART-003",
        "E4R1-CANON-001"
      ]
    },
    {
      "from": "E4R2-REF-001",
      "depends_on": [
        "PKG-002"
      ]
    },
    {
      "from": "E4R2-CANON-001",
      "depends_on": [
        "DIGEST-CANON-002"
      ]
    },
    {
      "from": "E4R2-BIND-001",
      "depends_on": [
        "E4R1-BIND-001"
      ]
    },
    {
      "from": "E4R2-NEG-001",
      "depends_on": [
        "E4R1-NEG-001"
      ]
    },
    {
      "from": "E4R2-GRAPH-001",
      "depends_on": [
        "E4R1-PART-003"
      ]
    },
    {
      "from": "E4R2-PROFILE-001",
      "depends_on": [
        "PKG-002",
        "E4R1-BIND-001"
      ]
    },
    {
      "from": "E4R2-CLOSE-001",
      "depends_on": [
        "E4R1-CLOSE-001",
        "E4R2-REF-001",
        "E4R2-CANON-001",
        "E4R2-NEG-001",
        "E4R2-GRAPH-001"
      ]
    }
  ],
  "derivation": "RULES[].DEPENDS_ON",
  "required_equality": "EXACT_NODE_AND_EDGE_SET"
}
